<?xml version ="1.0" encoding = "UTF-8"?>
<d:dance xmlns:xsi="http://www.w3.org/2001/XMLSchema-instance"
         xsi:schemaLocation="http://www.epam.com/ism/danceProgramms dance.xsd"
         xmlns:d="http://www.epam.com/ism/danceProgramms">
        <danceRoutine orderInProgram = "id1" actName = "title1" typeOfCollective = "mass">
            <type>break-dance</type>
            <scene>street</scene>
            <musicAccompaniment type = "phonogram">
                <genre>Hip-Hop</genre>
                <title>Please stand up</title>
                <duration>4.25</duration>
            </musicAccompaniment>
            <dancers groupName = "Quest Crew" numberOfMembers = "5">
                <dancer>
                    <name>Hokuto Konishi</name>
                    <age>17</age>
                    <experience>2</experience>
                </dancer>

                <dancer>
                    <name>Steve Terada</name>
                    <age>19</age>
                    <experience>3</experience>
                </dancer>

                <dancer>
                    <name>Ryan Conferido</name>
                    <age>18</age>
                    <experience>3</experience>
                </dancer>

                <dancer>
                    <name>Dominic Sandoval</name>
                    <age>20</age>
                    <experience>3</experience>
                </dancer>

                <dancer>
                    <name>Aris Paracuelles</name>
                    <age>19</age>
                    <experience>3</experience>
                </dancer>

            </dancers>
        </danceRoutine>

        <danceRoutine orderInProgram = "id2" actName = "title2" typeOfCollective = "pair">
            <type>Viennese waltz</type>
            <scene>Palace Belvedere</scene>
            <musicAccompaniment type = "phonogram">
                <genre>Ballad</genre>
                <title>Hijo de la Luna</title>
                <duration>4.14</duration>
            </musicAccompaniment>
            <dancers groupName = "The Angels" numberOfMembers = "2">
                <dancer>
                    <name>Brian Williams</name>
                    <age>25</age>
                    <experience>10</experience>
                </dancer>

                <dancer>
                    <name>Nancy Hill</name>
                    <age>23</age>
                    <experience>9</experience>
                </dancer>

            </dancers>
        </danceRoutine>

        <danceRoutine orderInProgram = "id3" actName = "title3" typeOfCollective = "solo">
            <type>Latina Solo</type>
            <scene>Assembly hall</scene>
            <musicAccompaniment type = "phonogram">
                <genre>Reggaeton</genre>
                <title>Ayudame Imaginar</title>
                <duration>3.51</duration>
            </musicAccompaniment>
            <dancers groupName = "" numberOfMembers = "1">
                <dancer>
                    <name>Katherine Ramirez</name>
                    <age>25</age>
                    <experience>15</experience>
                </dancer>
            </dancers>
        </danceRoutine>
</d:dance>